song_name,artist_name,album_name,thumbnail,queryname,links
Black Balloons,Destroyer,Where Do I Sign?,Heaven Don't Have a Name,Happy Pills,<maybe> it's my fault,Save Yourself,parents,Glass Heart,Dead Inside,Running Up That Hill (A Deal With God),Candy Coated Lie$,Lavender Bones,Love It When You Hate Me (feat. blackbear),My Songs Know What You Did In The Dark (Light Em Up),I'll Sleep When I'm Dead,Why Worry,Partners in Crime (feat. Ash Costello),C'est la vie,HOLD ME TIGHT OR DON’T,Memories (with WILLOW),Jessica,Monster,I Think I'm OKAY (with YUNGBLUD & Travis Barker),my ex's best friend (with blackbear),forget me too (feat. Halsey),Irresistible,Born For Greatness,Last Resort,The Game,The Night,The Diary of Jane - Single Version,Part of Me,Waiting On The Sky To Change,Zombie,Painkiller,Awake and Alive,Monster,Untraveled Road,Take It Out On Me,War of Change,Perfect Insanity,Are You Ready,Stupify,This Moment,Decadence,Prayer,Divisive,Unstoppable,Inside the Fire,The Vengeful One,Indestructible,Down with the Sickness,Stricken,Hey You,emo girl (feat. WILLOW),RECOVER,"deathwish (feat. nothing,nowhere.)",HandClap,sTraNgeRs,Main Attraction,Everyone's a Secret,gfy (with Machine Gun Kelly),29,A$$A$$IN,Call Me a Saint,Stronger,Mr. Doctor Man,Monsters (feat. blackbear),Sleepwalking,Any Other Way,Loser,Born For This,Demon,Running Away from Home,Killer In The Mirror,Killing Me Slowly,Zombie,"You're Gonna Go Far, Kid",Lost In the Night (Chainsaw Man),Devil in Disguise,"One Hell of a Team (Inspired by ""Hazbin Hotel"")",Emperor's New Clothes,Come and Get It from Me,cinderella's dead,Boyfriend,Wicked Witch of the Westside,Control,House of Memories,Devil I Know,Sociopath,Playground (from the series Arcane League of Legends),Meant to be Yours,Usseewa,"STORY (From ""Isekai Ojisan: Uncle from Another World"")",Tot Musica,"Tot Musica (From ""One Piece Film: Red"")",No Lie,Unholy (feat. Kim Petras),STAY (with Justin Bieber),Payroll (feat. Kranium),you were there for me,Let Me Down Slowly,As It Was,Levitating (feat. DaBaby),In My Blood,My Head & My Heart,Break My Heart,Infinity,good 4 u,abcdefu,Bad Liar,INDUSTRY BABY (feat. Jack Harlow),Woman Like Me (feat. Nicki Minaj),Here With Me,More Than You Know,Arcade,Shivers,Youngblood,Physical,hot girl bummer,Dusk Till Dawn (feat. Sia) - Radio Edit,Bad Habits,ラヴァーズ,The Beginning,よふかしのうた,堕天,ロスタイム,"Lose Yourself - From ""8 Mile"" Soundtrack",When I'm Gone,Side To Side,Dangerous Woman,River (feat. Ed Sheeran),Lean On (feat. MØ & DJ Snake),7 rings,I Mean It (feat. Remo),"Shell Shocked (feat. Kill the Noise & Madsonik) - From ""Teenage Mutant Ninja Turtles""",Rockabye (feat. Anne-Marie) - Recorded at Spotify Studios NYC,the AUDACITY,you make a woman wanna...,temporary funeral,plot line,my best friend's ex,B.O.M.B.,rapunzel,Bejeweled,Midnight Rain,Snow On The Beach (feat. Lana Del Rey),Maroon,Lavender Haze,Unstoppable,Mistake,Ashes,Beggin',I WANNA BE YOUR SLAVE,One Kiss (with Dua Lipa),Bite Me,Love Sux – Spotify Singles,girl’s girl - Spotify Singles,Karma,Question...?,Lavender Haze,Midnight Rain,Anti-Hero,Vigilante Shit,Exist,1,KICK BACK,Nightmare,Don’t Blame Me,Crown,The Hero / One-Punch Man - Japanese,Burst The Gravity,Fight 4 Real,Immortals,Who Do You Love,Teeth,Selfish,Go Cry Go,Take Over,STRIKE THE BLOOD,End It,Gasoline,セルフロンティア,RiGHT NOW,BLESS YoUr NAME,Queen,High for Me (feat. Kid Ink),"The Edge of Dawn (from ""Fire Emblem: Three Houses"")",Gospel of the Throttle,End Of The Night,Awakened,Legends Never Die - (Remix),Playground (from the series Arcane League of Legends),Warriors,Get Jinxed,GIANTS,Phoenix,THE BADDEST,RISE,POP/STARS,No Way,gravityWall,Go Cry Go (Overlord) [feat. Romi],The River,Burn It All Down,ASH,Battlefield,Boy,Drag Me Down,NAMELY,Can You Sleep At Night,Crossed The Line,I'm A Monster,VILLAIN,Come & Go (with Marshmello),99.9,Radioactive Mother (Lover),Real One,Vanguard,逆境スペクトル,Throne,Soul salvation,Stronger,Boomerang,My Life Is Going On (Música Original De La Serie De TV La Casa De Papel / Money Heist),Royalty,No Rival,BOO HOO,Leave Me Alone,Echo,Broken Sky,OveR,Eastside (with Halsey & Khalid),Be Kind (with Halsey),Closer,Without Me,A Whole New World,Keep It Under,Cry Baby (Tokyo Revengers),スカイクラッドの観測者,Work from Home (feat. Ty Dolla $ign),"Xian - Vocal (From ""the Daily Life of the Immortal King"")",BLIZZARD (Outr3ach Remix) - SACRA BEATS Singles,Easier – Remix (with Charlie Puth),朝が来る,Sucker,Wicked feat. Mori Calliope,CapSule,Red,失礼しますが、RIP♡,MERA MERA,Villain Vibes (feat. Mori Calliope),Call Me King,MWTWB,Monster U Made,Metamorphosis,From The Embers,Die For a Man (feat. Lil Uzi Vert),Last Hurrah,Grace,F.F.F. (feat. G-Eazy),Girl in the Mirror,I Can't Stop Drinking About You,I'm Gonna Show You Crazy,Say My Name,"Let It Go - From ""Frozen""/Soundtrack Version",Tie Me Down (with Elley Duhé),Happy Now,MIDDLE OF THE NIGHT,de messiah,World I Never Knew,Sing My Pleasure,Resolution,Señorita,ピースサイン,"Thought I Knew ft. ra’z, Hayes",炎,Move Mountains,Eden through the rough,Face Off,Sober,Him & I (with Halsey),"Me, Myself & I",Unstoppable,"Sit Still, Look Pretty",Liar,psychofreak (feat. WILLOW),"Enemy (from ""Arcane League of Legends"")",Space Bound,Wellerman - Sea Shanty,Castle,25 To Life,"Last One Standing (feat. Polo G, Mozzy & Eminem) - From Venom: Let There Be Carnage",I Love U,only my railgun,レイメイ,Sign,明け星,明け星,The Rumbling,bad guy,RESISTER,Grenade,Seven Deadly Sins,Shonen Jump 2,Thunder (Zenitsu Rap) [feat. Shwabadi],Shonen Jump,Blood (Alucard Rap),残響散歌,火炎,衝動,Alive,chAngE,ないない,アイリス,unlasting,Touch off,ギャンブル,Black Rover,永遠に光れ (Everlasting Shine),Cry Baby,ブルーバード,"1,000,000 TIMES feat. chelly (EGOIST)",graphite/diamond,from the edge,time,ADAMAS,TVアニメ「デジモンアドベンチャー:」挿入歌 Break the chain,流星,See You Again (feat. Charlie Puth),Counting Stars,Let Me Love You,S&M,Heathens,fake love don't last (feat. iann dior),Sweet but Psycho,Beyond the Boundary (English Version),Be the one,Daylight,Kiss and Make Up,As If It's Your Last,Kill This Love,PLAYING WITH FIRE,SLUMP -Japanese ver.-,How You Like That,I'm a Mess,Believer,Lonely Together - (feat. Rita Ora) Alan Walker Remix,Shape of You,LA Girls,How Long,Stitches,Señorita,Dangerously,River,Pray For Me (with Kendrick Lamar),My Gospel,See You Again (feat. Charlie Puth),I Warned Myself,One Call Away,Attention,If I Can't Have You,There's Nothing Holdin' Me Back,Stitches,Treat You Better,Scared to Be Lonely,Thunder,Despacito,Rap God,We Don't Talk Anymore (feat. Selena Gomez),Look What You Made Me Do,FRIENDS,Bad Blood,Venom - Remix,Love The Way You Lie,Levitating,Roar,Not Afraid,Animals,Sorry,End of Time,"Gravity Wall (From ""Re:Creators"")","scaPEGoat (From ""Seraph of the End"")","Oath Sign (From ""Fate/Zero"")","REDO (from ""Re:Zero"")","Long Shot (From ""Re:Zero"")","RISE (from ""League of Legends"")","Oath Oracle (from ""Honkai Impact 3"")",白銀,Goya No Machiawase,dawn,"Inferno (from ""Fire Force"")",Rising Hope,"From the Edge (From ""Demon Slayer: Kimetsu no Yaiba"")",Insane,she's all i wanna be,All Eyes on You,Wake Up,Liar Mask,On My Way,Sorry,Lily,Kings & Queens,"Alone, Pt. II",Diamond Heart,Ignite,All Falls Down (feat. Juliander),The Spectre,Faded,Different World (feat. CORSAK),Alone,Cheap Thrills,Havana (feat. Young Thug),Takeaway,Darkside,Dark seeks light,空想メソロギヰ,TOP -Japanese ver.-,Contradiction (feat. Tyler Carter),残酷な夢と眠れ,Salvaged,"Sen no Tsubasa (From ""Re:_Hamatora"")","Jingo Jungle (From ""Saga of Tanya the Evil"")","Crying For Rain (From ""Domestic Girlfriend"")",Angel With a Shotgun,"Hacking to the Gate (from ""Steins;Gate"")","Guren No Yumiya (From ""Attack on Titan"")","aLIEz (From ""Aldnoah.Zero"")","Black Catcher (from ""Black Clover"")","L.L.L. (From ""Overlord"")","Resonance (From ""Soul Eater"")","One Reason (From ""Deadman Wonderland"")","Resister (from ""Sword Art Online: Alicization"")","Courage (From ""Sword Art Online II"")","NO-LIMIT (from ""Fairy Tail"")","Kaibutsu (from ""BEASTARS"")",Wolf In Sheep's Clothing,"Shinzou wo Sasageyo (From ""Attack on Titan"")","Open Your Eyes (From ""Occultic;Nine"")",Addict,"This Game (From ""No Game No Life"")","Again (From ""Fullmetal Alchemist: Brotherhood"")","Black Catcher (from ""Black Clover"")","Ignite (From ""Sword Art Online II"")",Let Me Hear,廻廻奇譚,紅蓮華,"Inside of Every Demon (From ""Hazbin Hotel"") [REMIX]",Anti world,Baddest,Tokyo Ghoul Opening (Unravel),Speechless (Full),Like Flames,final phase,BAKU (CORSAK Remix) - SACRA BEATS Singles,カワキヲアメク,Be Down,SPARK-AGAIN,the WORLD,Black Catcher,熱情のスペクトラム,VIVID VICE,ANIMA,ファティマ,sugar sweet nightmare,楽園,声?
Ellise,Skillet,Weathers,Jeremy Renner,Weathers,WILLOW,ONE OK ROCK,YUNGBLUD,Caskets,Future Palace,Lø Spirit,Hot Milk,Stand Atlantic,Avril Lavigne,Fall Out Boy,Set It Off,Set It Off,Set It Off,Weathers,Fall Out Boy,YUNGBLUD,girlfriends,STARSET,Machine Gun Kelly,Machine Gun Kelly,Machine Gun Kelly,Fall Out Boy,Papa Roach,Papa Roach,Disturbed,Disturbed,Breaking Benjamin,Disturbed,STARSET,Bad Wolves,Three Days Grace,Skillet,Skillet,Thousand Foot Krutch,Thousand Foot Krutch,Thousand Foot Krutch,Disturbed,Disturbed,Disturbed,Disturbed,Disturbed,Disturbed,Disturbed,Disturbed,Disturbed,Disturbed,Disturbed,Disturbed,Disturbed,Disturbed,Machine Gun Kelly,Point North,Stand Atlantic,Fitz and The Tantrums,Bring Me The Horizon,Jeremy Renner,Lø Spirit,blackbear,Demi Lovato,Beauty School Dropout,YONAKA,The Score,Palaye Royale,All Time Low,Smash Into Pieces,We The Kings,Sueco,The Score,Savage Hands,Smash Into Pieces,Set It Off,Bad Wolves,Bad Wolves,The Offspring,Rustage,EMM,AmaLee,Panic! At The Disco,Sun Heat,EMELINE,Dove Cameron,Ellise,Halsey,Panic! At The Disco,Allie X,StayLoose,Bea Miller,Jamie Muscato,Ado,Miura Jam,Ado,AmaLee,Sean Paul,Sam Smith,The Kid LAROI,RIKA,Henry Moodie,Alec Benjamin,Harry Styles,Dua Lipa,Shawn Mendes,Ava Max,Dua Lipa,Jaymes Young,Olivia Rodrigo,GAYLE,Imagine Dragons,Lil Nas X,Little Mix,Marshmello,Axwell /\ Ingrosso,Duncan Laurence,Ed Sheeran,5 Seconds of Summer,Dua Lipa,blackbear,ZAYN,Ed Sheeran,7!!,ONE OK ROCK,Creepy Nuts,Creepy Nuts,Creepy Nuts,Eminem,Eminem,Ariana Grande,Ariana Grande,Eminem,Major Lazer,Ariana Grande,G-Eazy,Juicy J,Clean Bandit,emlyn,emlyn,emlyn,emlyn,emlyn,emlyn,emlyn,Taylor Swift,Taylor Swift,Taylor Swift,Taylor Swift,Taylor Swift,Sia,Stellar,Stellar,Måneskin,Måneskin,Calvin Harris,Avril Lavigne,Avril Lavigne,emlyn,Taylor Swift,Taylor Swift,Taylor Swift,Taylor Swift,Taylor Swift,Taylor Swift,MOB CHOIR,MOB CHOIR,Kenshi Yonezu,Halsey,Taylor Swift,Rustage,Rob Lundgren,Altima,Altima,Fall Out Boy,The Chainsmokers,5 Seconds of Summer,RIELL,Romix,League of Legends,KISIDA KYODAN & THE AKEBOSI ROCKETS,RIELL,Halsey,ASCA,EMPiRE,ChouCho,Loren Gray,Olivia Noelle,AmaLee,Dima Lancaster,Danny Avila,LEC,League of Legends,Bea Miller,League of Legends,League of Legends,True Damage,League of Legends,K/DA,League of Legends,K/DA,JRL,SawanoHiroyuki[nZk],Mattyyym,Axel Johansson,League of Legends,LiSA,Jordin Sparks,Reol,One Direction,UVERworld,Dima Lancaster,Vosai,Lucha,K/DA,Juice WRLD,MOB CHOIR,Smash Into Pieces,Smash Into Pieces,Smash Into Pieces,ASCA,Smash Into Pieces,Megumi Hayashibara,Smash Into Pieces,Smash Into Pieces,Cecilia Krull,Egzod,Egzod,Neoni,NF,THE BOYZ,富田美憂,富田美憂,benny blanco,Marshmello,The Chainsmokers,Halsey,Mena Massoud,Damien Dawn,Miura Jam,いとうかなこ,Fifth Harmony,Homura Records,BURNOUT SYNDROMES,5 Seconds of Summer,Aimer,Jonas Brothers,Hoshimachi Suisei,Mori Calliope,Mori Calliope,Mori Calliope,Mori Calliope,AmaLee,AmaLee,AmaLee,AmaLee,AmaLee,AmaLee,Bebe Rexha,Bebe Rexha,Bebe Rexha,Bebe Rexha,Bebe Rexha,Bebe Rexha,Bebe Rexha,David Guetta,Idina Menzel,Gryffin,Zedd,Elley Duhé,Nao Toyama,Fabvl,ヴィヴィ(Vo.八木海莉),Haruka Tomatsu,Shawn Mendes,Kenshi Yonezu,YVY,LiSA,アンジェラ (Vo. Alisa),Takanori Nishikawa,Tech N9ne,G-Eazy,G-Eazy,G-Eazy,Sia,Daya,Camila Cabello,Camila Cabello,AmaLee,Eminem,Nathan Evans,Eminem,Eminem,Skylar Grey,The Chainsmokers,fripSide,Sayuri,フロウ,LiSA,LiSA,SiM,Billie Eilish,ASCA,Bruno Mars,Rustage,Rustage,Rustage,Rustage,Rustage,Aimer,QUEEN BEE,Mashiro Ayano,Mashiro Ayano,miwa,ReoNa,Eir Aoi,LiSA,UVERworld,syudou,Vickeblanka,TOMORROW X TOGETHER,OFFICIAL HIGE DANDISM,Ikimonogakari,MY FIRST STORY,May'n,FictionJunction,SawanoHiroyuki[nZk],LiSA,Takayoshi Tanimoto,Eir Aoi,Wiz Khalifa,OneRepublic,DJ Snake,Rihanna,Twenty One Pilots,Machine Gun Kelly,Ava Max,MindaRyn,MindaRyn,MindaRyn,Dua Lipa,BLACKPINK,BLACKPINK,BLACKPINK,Stray Kids,BLACKPINK,Bebe Rexha,Imagine Dragons,Avicii,Ed Sheeran,Charlie Puth,Charlie Puth,Shawn Mendes,Shawn Mendes,Charlie Puth,Charlie Puth,The Weeknd,Charlie Puth,Wiz Khalifa,Charlie Puth,Charlie Puth,Charlie Puth,Shawn Mendes,Shawn Mendes,Shawn Mendes,Shawn Mendes,Martin Garrix,Imagine Dragons,Luis Fonsi,Eminem,Charlie Puth,Taylor Swift,Marshmello,Taylor Swift,Eminem,Eminem,Dua Lipa,Katy Perry,Eminem,Maroon 5,Justin Bieber,K-391,AmaLee,AmaLee,AmaLee,AmaLee,AmaLee,AmaLee,AmaLee,LiSA,Hello Sleepwalkers,LiSA,AmaLee,LiSA,Akano,Black Gryph0n,Tate McRae,Smash Into Pieces,Smash Into Pieces,真山りか,Alan Walker,Alan Walker,Alan Walker,Ava Max,Alan Walker,Alan Walker,Alan Walker,Alan Walker,Alan Walker,Alan Walker,Alan Walker,Alan Walker,Sia,Camila Cabello,The Chainsmokers,Alan Walker,ニノミヤユイ,Yousei Teikoku,Stray Kids,KSUKE,栗林みな実,NateWantsToBattle,FalKKonE,AmaLee,Geek Music,The Cab,AmaLee,AmaLee,AmaLee,AmaLee,AmaLee,AmaLee,AmaLee,AmaLee,AmaLee,AmaLee,AmaLee,NateWantsToBattle,AmaLee,AmaLee,Silva Hound,AmaLee,AmaLee,AmaLee,AmaLee,"Fear, and Loathing in Las Vegas",Eve,LiSA,AmaLee,高槻かなこ,樋口 楓,Yung Anime,Naomi Scott,MindaRyn,fripSide,Ikimonogakari,美波,ACCAMER,Aimer,Nightmare,Vickeblanka,Ikimonogakari,Who-ya Extended,ReoNa,いとうかなこ,物語シリーズ,Fujifabric,はてな
Black Balloons,Dominion,Where Do I Sign?,Heaven Don't Have a Name,Happy Pills,<COPINGMECHANISM>,Save Yourself,weird!,Lost Souls,Run,Running Up That Hill (A Deal With God),Candy Coated Lie$,Skinny Dipping,Love Sux,Save Rock And Roll,Cinematics (Deluxe),Duality,Cinematics (Expanded Edition),Pillows & Therapy,MANIA,Memories (with WILLOW),girlfriends,Vessels,Hotel Diablo,Tickets To My Downfall,Tickets To My Downfall,American Beauty/American Psycho,Crooked Teeth (Deluxe),Infest,The Sickness (10th Anniversary Edition),Indestructible (Deluxe Edition),Phobia (Clean Version),Divisive,Waiting On The Sky To Change,Disobey,Human,Awake,Awake,OXYGEN: INHALE,Welcome To The Masquerade (Fan Edition),The End Is Where We Begin,Indestructible (Deluxe Edition),Evolution,The Sickness,The Lost Children,Ten Thousand Fists,Believe,Divisive,Unstoppable,Indestructible (Deluxe Edition),Immortalized,Indestructible (Deluxe Edition),The Sickness (20th Anniversary Edition),Ten Thousand Fists,Divisive,mainstream sellout,RECOVER,f.e.a.r.,Fitz and The Tantrums,sTraNgeRs,The Medicine,Everyone's a Secret,in loving memory,29,We Made Plans & God Laughed,Seize the Power,Carry On,Boom Boom Room (Side A),"Wake Up, Sunshine",Sleepwalking,Somewhere Somehow,It Was Fun While It Lasted,Carry On,The Truth in Your Eyes,A New Horizon,Midnight,N.A.T.I.O.N.,Zombie,"Rise And Fall, Rage And Grace",Lost In the Night (Chainsaw Man),RUBY,"One Hell of a Team (Inspired by ""Hazbin Hotel"")",Death of a Bachelor,Ready to Go,cinderella's dead,Boyfriend,Letting the Wolf In,BADLANDS (Deluxe),Death of a Bachelor,Cape God,Sociopath,Arcane League of Legends (Soundtrack from the Animated Series),Heathers the Musical (Original West End Cast Recording),Kyougen,"STORY (From ""Isekai Ojisan: Uncle from Another World"")",UTA'S SONGS ONE PIECE FILM RED,"Tot Musica (From ""One Piece Film: Red"")",Mad Love The Prequel,Unholy (feat. Kim Petras),STAY (with Justin Bieber),Payroll (feat. Kranium),you were there for me,Narrated For You,As It Was,Future Nostalgia,Shawn Mendes,Heaven & Hell,Future Nostalgia,Feel Something,Hits Rentrée 2021,abcdefu,Origins (Deluxe),INDUSTRY BABY (feat. Jack Harlow),LM5 (Deluxe),Here With Me,More Than You Know,Small Town Boy,=,Youngblood (Deluxe),Future Nostalgia,everything means nothing,Dusk Till Dawn (feat. Sia) [Radio Edit],=,Anipps,JINSEI KAKETE BOKU WA,よふかしのうた,堕天,アンサンブル・プレイ,Just Lose It,When I'm Gone,Dangerous Woman,Dangerous Woman,Revival,Peace Is The Mission,"thank u, next",These Things Happen,"Shell Shocked (feat. Kill the Noise & Madsonik) [From ""Teenage Mutant Ninja Turtles""]",Spotify Singles,loneliest b!tch in america,loneliest b!tch in america,loneliest b!tch in america,plot line,my best friend's ex,confessions of a drama queen,loneliest b!tch in america,Midnights (3am Edition),Midnights (3am Edition),Midnights (3am Edition),Midnights (3am Edition),Midnights (3am Edition),This Is Acting (Deluxe Version),Mistake,Ashes,Chosen,Teatro d'ira - Vol. I,One Kiss (with Dua Lipa),Love Sux,Spotify Singles,girl’s girl - Spotify Singles,Midnights,Midnights,Midnights,Midnights,Midnights,Midnights,1,1,KICK BACK,Nightmare,reputation,Crown,"Covers the World, Vol. 3",Burst The Gravity,Fight 4 Real,American Beauty/American Psycho,World War Joy,13 Reasons Why (Season 3),Selfish,Go Cry Go,Take Over,STRIKE THE BLOOD,End It,BADLANDS (Deluxe),百歌繚乱,the GREAT JOURNEY ALBUM,ChouCho ColleCtion ”bouquet”,Queen,High for Me (feat. Kid Ink),"Total Coverage, Vol. 6",Gospel of the Throttle,End Of The Night,Awakened,Legends Never Die (Remix),Playground (from the series Arcane League of Legends),Warriors,The Music of League of Legends Vol. 1,GIANTS,Phoenix,THE BADDEST,RISE,POP/STARS,No Way,2V-Alk,Go Cry Go (Overlord) [feat. Romi],The River,Burn It All Down,ASH,Battlefield,THE SIXTH SENSE,Made In The A.M. (Deluxe Edition),30,Can You Sleep At Night,Crossed The Line,I'm A Monster,ALL OUT,Legends Never Die,99.9,Radioactive Mother (Lover),A New Horizon,Vanguard,君が見た夢の物語,Throne,Soul salvation,The Apocalypse DJ,Boomerang,My Life Is Going On (Música Original De La Serie De TV La Casa De Papel / Money Heist),Royalty,No Rival,BOO HOO,The Search,"Echo [From ""Solo Leveling"" (Original Soundtrack)]",Prologue,OveR,FRIENDS KEEP SECRETS,Be Kind (with Halsey),Closer,Manic,Aladdin (Original Motion Picture Soundtrack),Keep It Under,Cry Baby (Tokyo Revengers),ChaosAttractor,7/27 (Deluxe),"Xian - Vocal (From ""the Daily Life of the Immortal King"")",BLIZZARD (Outr3ach Remix) - SACRA BEATS Singles,Easier – Remix (with Charlie Puth),朝が来る,Happiness Begins,TEMPLATE/Wicked feat. Mori Calliope,CapSule,Your Mori.,DEAD BEATS,MERA MERA,Rise of the Monarch,Rise of the Monarch,Rise of the Monarch,Rise of the Monarch,Rise of the Monarch,Rise of the Monarch,Die For a Man (feat. Lil Uzi Vert),Last Hurrah,Expectations,All Your Fault: Pt. 1,UglyDolls (Original Motion Picture Soundtrack),I Can't Stop Drinking About You,I'm Gonna Show You Crazy,7,Frozen (Original Motion Picture Soundtrack / Deluxe Edition),Gravity,Happy Now,MIDDLE OF THE NIGHT,Anohino Kotoba / Growing,World I Never Knew,Sing My Pleasure,Resolution,Shawn Mendes (Deluxe),Peace Sign - EP,"Thought I Knew ft. ra’z, Hayes",炎,Move Mountains,Eden through the rough,ASIN9NE,The Beautiful & Damned,The Beautiful & Damned,When It's Dark Out,This Is Acting,"Sit Still, Look Pretty",Liar,Familia,"Enemy (from ""Arcane League of Legends"")",Recovery,Wellerman (Sea Shanty),Revival,Recovery,"Last One Standing (feat. Polo G, Mozzy & Eminem) [From Venom: Let There Be Carnage]",So Far So Good,only my railgun,Dawn,MICROCOSM,明け星 / 白銀,明け星,The Rumbling,"WHEN WE ALL FALL ASLEEP, WHERE DO WE GO?",RESISTER (Special Edition),Doo-Wops & Hooligans,Seven Deadly Sins,Shonen Jump 2,Thunder (Zenitsu Rap) [feat. Shwabadi],Shonen Jump,Blood (Alucard Rap),残響散歌,火炎(Full Edition),衝動,Alive,guitarissimo,ないない (Special Edition),アイリス,unlasting,UNSER,ギャンブル,ウララ,DRAMA,Cry Baby,超いきものばかり〜てんねん記念メンバーズBESTセレクション〜,"1,000,000 TIMES",graphite/diamond,from the edge,iv,Akai Wana (Who Loves It?) / ADAMAS,TVアニメ「デジモンアドベンチャー:」挿入歌 Break the chain,流星 / 約束,See You Again (feat. Charlie Puth),Native,Encore,Loud,Heathens,mainstream sellout,Heaven & Hell,Daylight,Be the one,Daylight,Dua Lipa (Complete Edition),As If It's Your Last,Kill This Love,SQUARE TWO,SLUMP -Japanese ver.-,THE ALBUM,Expectations,Evolve,Lonely Together (Remixes),÷ (Deluxe),Voicenotes,Voicenotes,Handwritten,Señorita,Nine Track Mind,Nine Track Mind (Deluxe Edition),Black Panther The Album Music From And Inspired By,Nine Track Mind,Nine Track Mind,I Warned Myself,Nine Track Mind,Voicenotes,If I Can't Have You,Illuminate (Deluxe),Handwritten (Deluxe),Illuminate,Scared to Be Lonely,Evolve,VIDA,The Marshall Mathers LP2 (Deluxe),Nine Track Mind,reputation,FRIENDS,1989,"Last One Standing (feat. Polo G, Mozzy & Eminem) [From Venom: Let There Be Carnage]",Recovery,Future Nostalgia,PRISM (Deluxe),Recovery,V (Asia Tour Edition),Purpose (Deluxe),End of Time,"Total Coverage, Vol. 4",Nostalgia VI,Nostalgia VII,"Total Coverage, Vol. 6","Long Shot (From ""Re:Zero"")","RISE (from ""League of Legends"")","Oath Oracle (from ""Honkai Impact 3"")",明け星 / 白銀,Masked Monkey Awakening,dawn,"Inferno (from ""Fire Force"")",Launcher,"From the Edge (From ""Demon Slayer: Kimetsu no Yaiba"")",Insane,she's all i wanna be,Arcadia,Arcadia,Liar Mask,On My Way,Sorry,Different World,Heaven & Hell,"Alone, Pt. II",Different World,Ignite,Different World,The Spectre,Different World,Different World,Different World,This Is Acting,Camila,World War Joy,Different World,Dark seeks light / 散文的LIFE,PAX VESANIA,TOP -Japanese ver.-,Contradiction (feat. Tyler Carter),残酷な夢と眠れ,Mangled,"Intense Symphonic Metal Covers, Vol. 20","Total Coverage, Vol. 3","The Anime Collection, Vol. 5",Symphony Soldier,"Hacking to the Gate (from ""Steins;Gate"")",Nostalgia IV,"Total Coverage, Vol. 1","Black Catcher (from ""Black Clover"")","L.L.L. (From ""Overlord"")",Nostalgia V,"Total Coverage, Vol. 1","Resister (from ""Sword Art Online: Alicization"")","Courage (From ""Sword Art Online II"")","Total Coverage, Vol. 5","Kaibutsu (from ""BEASTARS"")",Wolf In Sheep's Clothing,"Shinzou wo Sasageyo (From ""Attack on Titan"")","Open Your Eyes (From ""Occultic;Nine"")",Addict Remixed,Nostalgia VII,"Total Coverage, Vol. 1","Total Coverage, Vol. 5",Nostalgia VI,Feeling of Unity,廻廻奇譚 / 蒼のワルツ,Gurenge,The Remixes,Anti world,Baddest,Tokyo Ghoul Opening (Unravel),Aladdin (Original Motion Picture Soundtrack),Like Flames,final phase,BAKU (CORSAK Remix) - SACRA BEATS Singles,カワキヲアメク,Be Down / ダイバーシティ,SPARK-AGAIN,the WORLD Ruler,Devil,熱情のスペクトラム/涙がきえるなら,VIVID VICE,unknown,ファティマ(TVアニメ「シュタインズ・ゲート ゼロ」OPテーマ),Bakemonogatari Gekihanongakushu (Original Soundtrack),楽園,声?
